{
    "$schema": "https://raw.githubusercontent.com/BigBoot/GiganticEmu/master/GiganticEmu.ModdingToolkit/Resources/GiganticEmu.Mod.Schema.json",
    "Description": "Disable the countdown in the lobby for servers",
    "Author": "BigBoot",
    "Builds": [
        510547
    ],
    "Patches": [
        {
            "Type": "PatchFunctionHEX",
            "File": "RxGame.upk",
            "Class": "RxPreGameGRI",
            "Function": "UpdateCountdowns",
            "Before": "A6 01 80 B5 00 00 16",
            "After": "8D 01 80 B5 00 00 16"
        }
    ]
}