{
    "$schema": "https://raw.githubusercontent.com/BigBoot/GiganticEmu/master/GiganticEmu.ModdingToolkit/Resources/GiganticEmu.Mod.Schema.json",
    "Description": "Fix black screen when joining lobby on for a dedicated server",
    "Author": "BigBoot",
    "Builds": [
        510547
    ],
    "Patches": [
        {
            "Type": "PatchFunctionHEX",
            "File": "RxGame.upk",
            "Class": "RxHeroSelectorPRI",
            "Function": "AreNonPlatformMinionLoadoutsAllowed",
            "Before": "00 0A FD FF FF 00 01 0A FD FF FF 38 3A 24 01 16",
            "After": "00 0A FD FF FF 00 01 0A FD FF FF 38 3A 24 04 16"
        }
    ]
}